{"id":"obs_Dd3Dd3Dd3Dd3Dd3Dd3","source_id":"src_Bb1Bb1Bb1Bb1Bb1Bb1","job_id":"job_Cc2Cc2Cc2Cc2Cc2Cc2","track_id":7,"category":"person_in_declared_zone","interval":{"start_ms":15000,"end_ms":19500},"samples":[{"pts_ms":15000,"bbox_norm":[0.4,0.5,0.1,0.3],"score":0.81,"inside_zone":true},{"pts_ms":15500,"bbox_norm":[0.41,0.5,0.1,0.3],"score":0.83,"inside_zone":true}],"detector":{"name":"doble-de-prueba","version":"0","weights_sha256":"cccccccccccccccccccccccccccccccccccccccccccccccccccccccccccccccc"},"rule":{"rule_version":"zone-rule-v1","zone_version":1,"dwell_ms":2000}}
